{
  "company": "NVIDIA Corporation",
  "ticker": "NVDA",
  "reporting_period": "2023",
  "currency": "USD",
  "schema": {
    "profile": "US_GAAP_SEC",
    "standard": "United States Generally Accepted Accounting Principles (US GAAP)",
    "presentation_standard": "FASB ASC Topic 210 and SEC Regulation S-X Rule 5-02",
    "statement_type": "balance_sheet",
    "statement_scope": "consolidated",
    "jurisdiction": "United States",
    "monetary_unit": "USD",
    "amount_scale": "1",
    "operating_cash_flow_method": "not_applicable",
    "presentation_basis": "current_non_current",
    "expense_analysis": "not_applicable"
  },
  "source": {
    "statement": "Consolidated balance sheet",
    "basis": "Audited consolidated figures; source presented in USD millions and normalized to full USD",
    "report": "NVIDIA Fiscal 2024 Form 10-K",
    "url": "https://www.sec.gov/Archives/edgar/data/1045810/000104581024000029/nvda-20240128.htm",
    "page": "Form 10-K p. 52; Notes pp. 64 and 68-72",
    "taxonomy_element": "us-gaap:StatementOfFinancialPositionClassified",
    "as_of": "2023-01-29"
  },
  "assets": {
    "current": [
      {
        "canonical_field": "cash_and_cash_items",
        "name": "Cash and cash items",
        "amount": "3389000000",
        "source_field": "Cash and cash equivalents",
        "description": "This indicator represents cash and cash items. NVIDIA filed 'Cash and cash equivalents' at 3389 USD millions in NVIDIA Fiscal 2024 Form 10-K; it is mapped to US_GAAP_SEC field 'cash_and_cash_items' and converted to full USD without adding precision.",
        "source_reference": "Form 10-K p. 52; Notes pp. 64 and 68-72",
        "is_deduction": false,
        "is_subtotal": false,
        "cash_flow_direction": "not_applicable",
        "is_non_cash": false
      },
      {
        "canonical_field": "restricted_cash_current",
        "name": "Restricted cash - current",
        "amount": "0",
        "source_field": "[not separately reported] Restricted cash - current",
        "description": "This indicator represents restricted cash - current. NVIDIA did not separately report this US_GAAP_SEC field for 2023; it is explicitly normalized to zero to keep the canonical field set complete.",
        "source_reference": "Form 10-K p. 52; Notes pp. 64 and 68-72",
        "is_deduction": false,
        "is_subtotal": false,
        "cash_flow_direction": "not_applicable",
        "is_non_cash": false
      },
      {
        "canonical_field": "marketable_securities_current",
        "name": "Marketable securities - current",
        "amount": "9907000000",
        "source_field": "Marketable securities",
        "description": "This indicator represents marketable securities - current. NVIDIA filed 'Marketable securities' at 9907 USD millions in NVIDIA Fiscal 2024 Form 10-K; it is mapped to US_GAAP_SEC field 'marketable_securities_current' and converted to full USD without adding precision.",
        "source_reference": "Form 10-K p. 52; Notes pp. 64 and 68-72",
        "is_deduction": false,
        "is_subtotal": false,
        "cash_flow_direction": "not_applicable",
        "is_non_cash": false
      },
      {
        "canonical_field": "accounts_receivable_trade",
        "name": "Trade accounts receivable",
        "amount": "3827000000",
        "source_field": "Accounts receivable, net",
        "description": "This indicator represents trade accounts receivable. NVIDIA filed 'Accounts receivable, net' at 3827 USD millions in NVIDIA Fiscal 2024 Form 10-K; it is mapped to US_GAAP_SEC field 'accounts_receivable_trade' and converted to full USD without adding precision.",
        "source_reference": "Form 10-K p. 52; Notes pp. 64 and 68-72",
        "is_deduction": false,
        "is_subtotal": false,
        "cash_flow_direction": "not_applicable",
        "is_non_cash": false
      },
      {
        "canonical_field": "accounts_receivable_related_parties",
        "name": "Related-party accounts receivable",
        "amount": "0",
        "source_field": "[not separately reported] Related-party accounts receivable",
        "description": "This indicator represents related-party accounts receivable. NVIDIA did not separately report this US_GAAP_SEC field for 2023; it is explicitly normalized to zero to keep the canonical field set complete.",
        "source_reference": "Form 10-K p. 52; Notes pp. 64 and 68-72",
        "is_deduction": false,
        "is_subtotal": false,
        "cash_flow_direction": "not_applicable",
        "is_non_cash": false
      },
      {
        "canonical_field": "accounts_receivable_other",
        "name": "Other accounts receivable",
        "amount": "0",
        "source_field": "[not separately reported] Other accounts receivable",
        "description": "This indicator represents other accounts receivable. NVIDIA did not separately report this US_GAAP_SEC field for 2023; it is explicitly normalized to zero to keep the canonical field set complete.",
        "source_reference": "Form 10-K p. 52; Notes pp. 64 and 68-72",
        "is_deduction": false,
        "is_subtotal": false,
        "cash_flow_direction": "not_applicable",
        "is_non_cash": false
      },
      {
        "canonical_field": "notes_receivable",
        "name": "Notes receivable",
        "amount": "0",
        "source_field": "[not separately reported] Notes receivable",
        "description": "This indicator represents notes receivable. NVIDIA did not separately report this US_GAAP_SEC field for 2023; it is explicitly normalized to zero to keep the canonical field set complete.",
        "source_reference": "Form 10-K p. 52; Notes pp. 64 and 68-72",
        "is_deduction": false,
        "is_subtotal": false,
        "cash_flow_direction": "not_applicable",
        "is_non_cash": false
      },
      {
        "canonical_field": "allowance_for_credit_losses",
        "name": "Allowance for credit losses",
        "amount": "0",
        "source_field": "[not separately reported] Allowance for credit losses",
        "description": "This indicator represents allowance for credit losses. NVIDIA did not separately report this US_GAAP_SEC field for 2023; it is explicitly normalized to zero to keep the canonical field set complete.",
        "source_reference": "Form 10-K p. 52; Notes pp. 64 and 68-72",
        "is_deduction": false,
        "is_subtotal": false,
        "cash_flow_direction": "not_applicable",
        "is_non_cash": false
      },
      {
        "canonical_field": "unearned_income_receivable_deduction",
        "name": "Unearned income receivable deduction",
        "amount": "0",
        "source_field": "[not separately reported] Unearned income receivable deduction",
        "description": "This indicator represents unearned income receivable deduction. NVIDIA did not separately report this US_GAAP_SEC field for 2023; it is explicitly normalized to zero to keep the canonical field set complete.",
        "source_reference": "Form 10-K p. 52; Notes pp. 64 and 68-72",
        "is_deduction": false,
        "is_subtotal": false,
        "cash_flow_direction": "not_applicable",
        "is_non_cash": false
      },
      {
        "canonical_field": "inventories",
        "name": "Inventories",
        "amount": "5159000000",
        "source_field": "Inventories",
        "description": "This indicator represents inventories. NVIDIA filed 'Inventories' at 5159 USD millions in NVIDIA Fiscal 2024 Form 10-K; it is mapped to US_GAAP_SEC field 'inventories' and converted to full USD without adding precision.",
        "source_reference": "Form 10-K p. 52; Notes pp. 64 and 68-72",
        "is_deduction": false,
        "is_subtotal": false,
        "cash_flow_direction": "not_applicable",
        "is_non_cash": false
      },
      {
        "canonical_field": "prepaid_expenses",
        "name": "Prepaid expenses",
        "amount": "458000000",
        "source_field": "Prepaid supply and capacity agreements",
        "description": "This indicator represents prepaid expenses. NVIDIA filed 'Prepaid supply and capacity agreements' at 458 USD millions in NVIDIA Fiscal 2024 Form 10-K; it is mapped to US_GAAP_SEC field 'prepaid_expenses' and converted to full USD without adding precision.",
        "source_reference": "Form 10-K p. 52; Notes pp. 64 and 68-72; Form 10-K Note 9, p. 69",
        "is_deduction": false,
        "is_subtotal": false,
        "cash_flow_direction": "not_applicable",
        "is_non_cash": false
      },
      {
        "canonical_field": "contract_assets",
        "name": "Contract assets",
        "amount": "0",
        "source_field": "[not separately reported] Contract assets",
        "description": "This indicator represents contract assets. NVIDIA did not separately report this US_GAAP_SEC field for 2023; it is explicitly normalized to zero to keep the canonical field set complete.",
        "source_reference": "Form 10-K p. 52; Notes pp. 64 and 68-72",
        "is_deduction": false,
        "is_subtotal": false,
        "cash_flow_direction": "not_applicable",
        "is_non_cash": false
      },
      {
        "canonical_field": "current_tax_assets",
        "name": "Current tax assets",
        "amount": "0",
        "source_field": "[not separately reported] Current tax assets",
        "description": "This indicator represents current tax assets. NVIDIA did not separately report this US_GAAP_SEC field for 2023; it is explicitly normalized to zero to keep the canonical field set complete.",
        "source_reference": "Form 10-K p. 52; Notes pp. 64 and 68-72",
        "is_deduction": false,
        "is_subtotal": false,
        "cash_flow_direction": "not_applicable",
        "is_non_cash": false
      },
      {
        "canonical_field": "other_current_assets",
        "name": "Other current assets",
        "amount": "333000000",
        "source_field": "Prepaid expenses and other current assets",